[
  {
    "schema_version": "2.0.0",
    "record_type": "reconciliation_manifest",
    "reconciliation_manifest_id": "g20.2024-rio.reconciliation",
    "institution": "G20",
    "summit_id": "G20.rio.2024",
    "inventory_source_id": "g20.2024-rio.leaders-declaration",
    "selected_subset_source_id": "g20.2024-rio.final.report",
    "extracted_inventory_count": 13,
    "extracted_selected_count": 13,
    "expected_inventory_count": 174,
    "expected_selected_count": 13,
    "validation_status": "incomplete",
    "reconciliation_warnings": [
      "full_inventory_not_enumerated_from_report_source",
      "inventory_source_document_not_ingested"
    ],
    "parser_version": "g20-2024-rio-adapter@2.0.0",
    "retrieval_date": "2026-07-24"
  }
]
